{
  "$schema": "https://json-schema.org/draft/2020-12/schema",
  "$id": "urn:spring-identity:audit-event:v1",
  "title": "Audit Event v1",
  "description": "Version 1 contract for audit events produced by Spring Identity.",
  "type": "object",
  "additionalProperties": false,
  "required": [
    "schemaVersion",
    "eventId",
    "eventType",
    "outcome",
    "occurredAt",
    "traceId",
    "actor",
    "subject",
    "session",
    "request",
    "reason"
  ],
  "properties": {
    "schemaVersion": {
      "type": "integer",
      "const": 1,
      "description": "The audit event contract version."
    },
    "eventId": {
      "type": "string",
      "format": "uuid",
      "pattern": "^[0-9a-f]{8}-[0-9a-f]{4}-4[0-9a-f]{3}-[89ab][0-9a-f]{3}-[0-9a-f]{12}$",
      "description": "A stable UUID version 4 identifier for the audit event."
    },
    "eventType": {
      "type": "string",
      "enum": [
        "LOGIN_SUCCEEDED",
        "LOGIN_FAILED",
        "REGISTER_STARTED",
        "REGISTER_SUCCEEDED",
        "REGISTER_FAILED",
        "EMAIL_VERIFICATION_SENT",
        "EMAIL_VERIFIED",
        "EMAIL_VERIFICATION_FAILED"
      ],
      "description": "The type of security-sensitive operation recorded."
    },
    "outcome": {
      "type": "string",
      "enum": [
        "SUCCESS",
        "FAILURE"
      ],
      "description": "Whether the audited operation succeeded or failed."
    },
    "occurredAt": {
      "type": "string",
      "format": "date-time",
      "pattern": "^\\d{4}-\\d{2}-\\d{2}T\\d{2}:\\d{2}:\\d{2}\\.\\d{3}Z$",
      "description": "The UTC timestamp when the audited operation occurred, with millisecond precision."
    },
    "traceId": {
      "type": "string",
      "pattern": "^(?!0{32}$)[0-9a-f]{32}$",
      "description": "The non-zero lowercase OpenTelemetry trace identifier."
    },
    "actor": {
      "type": "object",
      "additionalProperties": false,
      "required": [
        "userId"
      ],
      "properties": {
        "userId": {
          "type": [
            "string",
            "null"
          ],
          "format": "uuid",
          "description": "The identifier of the user who performed the operation, when known."
        }
      }
    },
    "subject": {
      "type": "object",
      "additionalProperties": false,
      "required": [
        "userId",
        "email"
      ],
      "properties": {
        "userId": {
          "type": [
            "string",
            "null"
          ],
          "description": "The identifier of the affected user account, when known."
        },
        "email": {
          "type": [
            "string",
            "null"
          ],
          "format": "email",
          "pattern": "^[^\\sA-Z]+$",
          "description": "The normalized lowercase email associated with the login attempt."
        }
      }
    },
    "session": {
      "type": "object",
      "additionalProperties": false,
      "required": [
        "sessionId"
      ],
      "properties": {
        "sessionId": {
          "type": [
            "string",
            "null"
          ],
          "description": "The authenticated session identifier, when available."
        }
      }
    },
    "request": {
      "type": "object",
      "additionalProperties": false,
      "required": [
        "requestId",
        "clientRequestId",
        "ipAddress",
        "userAgent",
        "forwardedHost",
        "forwardedProto"
      ],
      "properties": {
        "requestId": {
          "type": "string",
          "pattern": "^(?!0{32}$)[0-9a-f]{32}$",
          "description": "The trusted request identifier derived from the active trace."
        },
        "clientRequestId": {
          "type": [
            "string",
            "null"
          ],
          "description": "An optional untrusted request identifier supplied by the client."
        },
        "ipAddress": {
          "type": [
            "string",
            "null"
          ],
          "description": "The trusted effective client IPv4 or IPv6 address."
        },
        "userAgent": {
          "type": [
            "string",
            "null"
          ],
          "description": "The client User-Agent value when safe and available."
        },
        "forwardedHost": {
          "type": [
            "string",
            "null"
          ],
          "description": "The trusted forwarded host when proxy headers are enabled."
        },
        "forwardedProto": {
          "type": [
            "string",
            "null"
          ],
          "enum": [
            "http",
            "https",
            null
          ],
          "description": "The trusted forwarded protocol when available."
        }
      }
    },
    "reason": {
      "type": [
        "string",
        "null"
      ],
      "description": "The existing application exception code associated with a failed operation."
    }
  },
  "allOf": [
    {
      "if": {
        "properties": {
          "eventType": {
            "const": "LOGIN_SUCCEEDED"
          }
        },
        "required": [
          "eventType"
        ]
      },
      "then": {
        "properties": {
          "outcome": {
            "const": "SUCCESS"
          },
          "reason": {
            "const": null
          },
          "subject": {
            "properties": {
              "email": {
                "type": "string"
              }
            }
          }
        }
      }
    },
    {
      "if": {
        "properties": {
          "eventType": {
            "const": "LOGIN_FAILED"
          }
        },
        "required": [
          "eventType"
        ]
      },
      "then": {
        "properties": {
          "outcome": {
            "const": "FAILURE"
          },
          "reason": {
            "type": "string",
            "minLength": 1
          },
          "subject": {
            "properties": {
              "email": {
                "type": "string"
              }
            }
          }
        }
      }
    },
    {
      "if": {
        "properties": {
          "eventType": {
            "const": "REGISTER_STARTED"
          }
        },
        "required": [
          "eventType"
        ]
      },
      "then": {
        "properties": {
          "outcome": {
            "const": "SUCCESS"
          },
          "reason": {
            "const": null
          },
          "actor": {
            "properties": {
              "userId": {
                "const": null
              }
            }
          },
          "subject": {
            "properties": {
              "email": {
                "type": "string"
              }
            }
          },
          "session": {
            "properties": {
              "sessionId": {
                "const": null
              }
            }
          }
        }
      }
    },
    {
      "if": {
        "properties": {
          "eventType": {
            "const": "REGISTER_SUCCEEDED"
          }
        },
        "required": [
          "eventType"
        ]
      },
      "then": {
        "properties": {
          "outcome": {
            "const": "SUCCESS"
          },
          "reason": {
            "const": null
          },
          "subject": {
            "properties": {
              "email": {
                "type": "string"
              }
            }
          }
        }
      }
    },
    {
      "if": {
        "properties": {
          "eventType": {
            "const": "REGISTER_FAILED"
          }
        },
        "required": [
          "eventType"
        ]
      },
      "then": {
        "properties": {
          "outcome": {
            "const": "FAILURE"
          },
          "reason": {
            "type": "string",
            "minLength": 1
          },
          "actor": {
            "properties": {
              "userId": {
                "const": null
              }
            }
          },
          "subject": {
            "properties": {
              "email": {
                "type": "string"
              }
            }
          }
        }
      }
    },
    {
      "if": {
        "properties": {
          "eventType": {
            "const": "EMAIL_VERIFICATION_SENT"
          }
        },
        "required": [
          "eventType"
        ]
      },
      "then": {
        "properties": {
          "outcome": {
            "const": "SUCCESS"
          },
          "reason": {
            "const": null
          },
          "actor": {
            "properties": {
              "userId": {
                "const": null
              }
            }
          },
          "subject": {
            "properties": {
              "email": {
                "type": "string"
              }
            }
          },
          "session": {
            "properties": {
              "sessionId": {
                "const": null
              }
            }
          }
        }
      }
    },
    {
      "if": {
        "properties": {
          "eventType": {
            "const": "EMAIL_VERIFIED"
          }
        },
        "required": [
          "eventType"
        ]
      },
      "then": {
        "properties": {
          "outcome": {
            "const": "SUCCESS"
          },
          "reason": {
            "const": null
          },
          "subject": {
            "properties": {
              "email": {
                "type": "string"
              }
            }
          }
        }
      }
    },
    {
      "if": {
        "properties": {
          "eventType": {
            "const": "EMAIL_VERIFICATION_FAILED"
          }
        },
        "required": [
          "eventType"
        ]
      },
      "then": {
        "properties": {
          "outcome": {
            "const": "FAILURE"
          },
          "reason": {
            "type": "string",
            "minLength": 1
          },
          "actor": {
            "properties": {
              "userId": {
                "const": null
              }
            }
          },
          "subject": {
            "properties": {
              "email": {
                "type": "string"
              }
            }
          }
        }
      }
    }
  ]
}
