{
  "schemaVersion": 1,
  "eventId": "550e8400-e29b-41d4-a716-446655440006",
  "eventType": "EMAIL_VERIFIED",
  "outcome": "SUCCESS",
  "occurredAt": "2026-07-21T14:05:00.000Z",
  "traceId": "b2c3d4e5f67890a1b2c3d4e5f67890a1",
  "actor": {
    "userId": null
  },
  "subject": {
    "userId": "7d5e6f8a-9b0c-4d1e-8f2a-3b4c5d6e7f8a",
    "email": "user@example.com"
  },
  "session": {
    "sessionId": null
  },
  "request": {
    "requestId": "b2c3d4e5f67890a1b2c3d4e5f67890a1",
    "clientRequestId": null,
    "ipAddress": "203.0.113.42",
    "userAgent": "Mozilla/5.0",
    "forwardedHost": null,
    "forwardedProto": null
  },
  "reason": null
}