{
  "schemaVersion": 1,
  "eventId": "550e8400-e29b-41d4-a716-446655440003",
  "eventType": "REGISTER_SUCCEEDED",
  "outcome": "SUCCESS",
  "occurredAt": "2026-07-21T12:00:01.234Z",
  "traceId": "3c8a12b5d9f647e0a4b7c6d5e4f3a2b1",
  "actor": {
    "userId": "7d5e6f8a-9b0c-4d1e-8f2a-3b4c5d6e7f8a"
  },
  "subject": {
    "userId": "7d5e6f8a-9b0c-4d1e-8f2a-3b4c5d6e7f8a",
    "email": "newuser@example.com"
  },
  "session": {
    "sessionId": null
  },
  "request": {
    "requestId": "3c8a12b5d9f647e0a4b7c6d5e4f3a2b1",
    "clientRequestId": null,
    "ipAddress": "203.0.113.42",
    "userAgent": "Mozilla/5.0",
    "forwardedHost": null,
    "forwardedProto": null
  },
  "reason": null
}